{
  "schema_version": "youtube_video_handoff.v1",
  "generatedAt": "2026-03-15T05:55:00+00:00",
  "source": "manual_youtube_asset_refresh:2026-03-15",
  "note": "Auto-merged from imports/exports/state, plus manual raw GitHub asset URLs for current target 016-022.",
  "target_days": [
    "009",
    "010",
    "011",
    "012",
    "013",
    "014",
    "015",
    "016",
    "017",
    "018",
    "019",
    "020",
    "021",
    "022"
  ],
  "unresolved_days": [],
  "items": [
    {
      "day": "009",
      "videoUrl": "https://ryo909.github.io/ai-dev-day-009/media/demo.webm",
      "titleOverride": "Signal Card Mixer",
      "descriptionOverride": "素材カードを引いて掛け合わせ、試作テーマを作る。",
      "thumbnailUrl": "",
      "dueAtOverride": "2026-03-09T21:00:00+09:00",
      "privacy": "public",
      "madeForKids": false,
      "notifySubscribers": true,
      "playlistCandidate": "",
      "audience": "general",
      "shortsCandidate": true,
      "videoSource": "imports/publish/youtube_video_handoff_latest.json",
      "assetStatus": "ready"
    },
    {
      "day": "010",
      "videoUrl": "https://ryo909.github.io/ai-dev-day-010/media/demo.webm",
      "titleOverride": "Tradeoff Path Wizard",
      "descriptionOverride": "質問に答えると、優先すべき選択肢へ分岐誘導する。",
      "thumbnailUrl": "",
      "dueAtOverride": "2026-03-10T08:30:00+09:00",
      "privacy": "public",
      "madeForKids": false,
      "notifySubscribers": true,
      "playlistCandidate": "",
      "audience": "general",
      "shortsCandidate": true,
      "videoSource": "imports/publish/youtube_video_handoff_latest.json",
      "assetStatus": "ready"
    },
    {
      "day": "011",
      "videoUrl": "https://ryo909.github.io/ai-dev-day-011/media/demo.webm",
      "titleOverride": "Risk Quadrant Mapper",
      "descriptionOverride": "項目をimpact×urgencyの4象限に配置して優先順を作る。",
      "thumbnailUrl": "",
      "dueAtOverride": "2026-03-11T12:10:00+09:00",
      "privacy": "public",
      "madeForKids": false,
      "notifySubscribers": true,
      "playlistCandidate": "",
      "audience": "general",
      "shortsCandidate": true,
      "videoSource": "imports/publish/youtube_video_handoff_latest.json",
      "assetStatus": "ready"
    },
    {
      "day": "012",
      "videoUrl": "https://ryo909.github.io/ai-dev-day-012/media/demo.webm",
      "titleOverride": "Weighted Option Calculator",
      "descriptionOverride": "重みを調整して候補案の総合点ランキングを算出する。",
      "thumbnailUrl": "",
      "dueAtOverride": "2026-03-12T09:00:00+09:00",
      "privacy": "public",
      "madeForKids": false,
      "notifySubscribers": true,
      "playlistCandidate": "",
      "audience": "general",
      "shortsCandidate": true,
      "videoSource": "imports/publish/youtube_video_handoff_latest.json",
      "assetStatus": "ready"
    },
    {
      "day": "013",
      "videoUrl": "https://ryo909.github.io/ai-dev-day-013/media/demo.webm",
      "titleOverride": "Slot Checklist Planner",
      "descriptionOverride": "時間枠にタスクを割り当て、完了チェック付きで進捗管理する。",
      "thumbnailUrl": "",
      "dueAtOverride": "2026-03-13T08:30:00+09:00",
      "privacy": "public",
      "madeForKids": false,
      "notifySubscribers": true,
      "playlistCandidate": "",
      "audience": "general",
      "shortsCandidate": true,
      "videoSource": "imports/publish/youtube_video_handoff_latest.json",
      "assetStatus": "ready"
    },
    {
      "day": "014",
      "videoUrl": "https://ryo909.github.io/ai-dev-day-014/media/demo.webm",
      "titleOverride": "Flow Board Builder",
      "descriptionOverride": "カードをレーン間で移動しながら作業フローを組み立てる。",
      "thumbnailUrl": "",
      "dueAtOverride": "2026-03-14T10:00:00+09:00",
      "privacy": "public",
      "madeForKids": false,
      "notifySubscribers": true,
      "playlistCandidate": "",
      "audience": "general",
      "shortsCandidate": true,
      "videoSource": "imports/publish/youtube_video_handoff_latest.json",
      "assetStatus": "ready"
    },
    {
      "day": "015",
      "videoUrl": "https://ryo909.github.io/ai-dev-day-015/media/demo.webm",
      "titleOverride": "Constraint Roulette",
      "descriptionOverride": "ルーレットを回して制約ミッションを抽選し、達成点を貯める。",
      "thumbnailUrl": "",
      "dueAtOverride": "2026-03-15T21:00:00+09:00",
      "privacy": "public",
      "madeForKids": false,
      "notifySubscribers": true,
      "playlistCandidate": "",
      "audience": "general",
      "shortsCandidate": true,
      "videoSource": "imports/publish/youtube_video_handoff_latest.json",
      "assetStatus": "ready"
    },
    {
      "day": "016",
      "videoUrl": "https://ryo909.github.io/ai-dev-day-016/media/demo.mp4",
      "titleOverride": "Budget Tradeoff Calculator",
      "descriptionOverride": "予算配分を動かして達成率と余剰リスクを比較する。",
      "thumbnailUrl": "",
      "dueAtOverride": "2026-03-16T21:00:00+09:00",
      "privacy": "public",
      "madeForKids": false,
      "notifySubscribers": true,
      "playlistCandidate": "",
      "audience": "general",
      "shortsCandidate": false,
      "videoSource": "https://ryo909.github.io/ai-dev-day-016/media/demo.mp4",
      "assetStatus": "ready"
    },
    {
      "day": "017",
      "videoUrl": "https://ryo909.github.io/ai-dev-day-017/media/demo.mp4",
      "titleOverride": "Incident Response Wizard",
      "descriptionOverride": "障害状況の選択入力から一次対応フローを確定する。",
      "thumbnailUrl": "",
      "dueAtOverride": "2026-03-17T08:30:00+09:00",
      "privacy": "public",
      "madeForKids": false,
      "notifySubscribers": true,
      "playlistCandidate": "",
      "audience": "general",
      "shortsCandidate": false,
      "videoSource": "https://ryo909.github.io/ai-dev-day-017/media/demo.mp4",
      "assetStatus": "ready"
    },
    {
      "day": "018",
      "videoUrl": "https://ryo909.github.io/ai-dev-day-018/media/demo_youtube_retry.mp4",
      "titleOverride": "Daily Routine Slotter",
      "descriptionOverride": "習慣タスクを朝昼夜の枠へ配置し、継続率を可視化する。",
      "thumbnailUrl": "",
      "dueAtOverride": "2026-03-18T12:10:00+09:00",
      "privacy": "public",
      "madeForKids": false,
      "notifySubscribers": true,
      "playlistCandidate": "",
      "audience": "general",
      "shortsCandidate": false,
      "videoSource": "https://ryo909.github.io/ai-dev-day-018/media/demo_youtube_retry.mp4",
      "assetStatus": "ready"
    },
    {
      "day": "019",
      "videoUrl": "https://ryo909.github.io/ai-dev-day-019/media/demo_youtube_retry.mp4",
      "titleOverride": "Challenge Chain Roulette",
      "descriptionOverride": "抽選された連続ミッションをこなし、チェイン倍率を伸ばす。",
      "thumbnailUrl": "",
      "dueAtOverride": "2026-03-19T09:00:00+09:00",
      "privacy": "public",
      "madeForKids": false,
      "notifySubscribers": true,
      "playlistCandidate": "",
      "audience": "general",
      "shortsCandidate": false,
      "videoSource": "https://ryo909.github.io/ai-dev-day-019/media/demo_youtube_retry.mp4",
      "assetStatus": "ready"
    },
    {
      "day": "020",
      "videoUrl": "https://ryo909.github.io/ai-dev-day-020/media/demo_youtube_retry.mp4",
      "titleOverride": "Dependency Flow Board",
      "descriptionOverride": "依存関係付きカードをボードで整理し、着手順を整える。",
      "thumbnailUrl": "",
      "dueAtOverride": "2026-03-20T08:30:00+09:00",
      "privacy": "public",
      "madeForKids": false,
      "notifySubscribers": true,
      "playlistCandidate": "",
      "audience": "general",
      "shortsCandidate": false,
      "videoSource": "https://ryo909.github.io/ai-dev-day-020/media/demo_youtube_retry.mp4",
      "assetStatus": "ready"
    },
    {
      "day": "021",
      "videoUrl": "https://ryo909.github.io/ai-dev-day-021/media/demo_youtube_retry.mp4",
      "titleOverride": "Stakeholder Matrix Mapper",
      "descriptionOverride": "利害関係者を影響力×関心度で整理し、対話順を決める。",
      "thumbnailUrl": "",
      "dueAtOverride": "2026-03-21T10:00:00+09:00",
      "privacy": "public",
      "madeForKids": false,
      "notifySubscribers": true,
      "playlistCandidate": "",
      "audience": "general",
      "shortsCandidate": false,
      "videoSource": "https://ryo909.github.io/ai-dev-day-021/media/demo_youtube_retry.mp4",
      "assetStatus": "ready"
    },
    {
      "day": "022",
      "videoUrl": "https://ryo909.github.io/ai-dev-day-022/media/demo_youtube_retry.mp4",
      "titleOverride": "Idea Combo Deck",
      "descriptionOverride": "目的カードと制約カードを混ぜ、実行可能な組み合わせを作る。",
      "thumbnailUrl": "",
      "dueAtOverride": "2026-03-22T21:00:00+09:00",
      "privacy": "public",
      "madeForKids": false,
      "notifySubscribers": true,
      "playlistCandidate": "",
      "audience": "general",
      "shortsCandidate": false,
      "videoSource": "https://ryo909.github.io/ai-dev-day-022/media/demo_youtube_retry.mp4",
      "assetStatus": "ready"
    }
  ]
}
