{
  "schema_version": "youtube_video_handoff.v1",
  "generatedAt": "2026-03-08T00:00:00Z",
  "source": "manual-template",
  "note": "Fill videoUrl for each day. title/description/dueAt overrides are optional.",
  "items": [
    {
      "day": "009",
      "videoUrl": "https://www.youtube.com/watch?v=REPLACE_DAY009",
      "titleOverride": "",
      "descriptionOverride": "",
      "thumbnailUrl": "",
      "dueAtOverride": "",
      "privacy": "public",
      "madeForKids": false,
      "notifySubscribers": true,
      "playlistCandidate": "",
      "audience": "general",
      "shortsCandidate": true
    },
    {
      "day": "010",
      "videoUrl": "https://www.youtube.com/watch?v=REPLACE_DAY010",
      "titleOverride": "",
      "descriptionOverride": "",
      "thumbnailUrl": "",
      "dueAtOverride": "",
      "privacy": "public",
      "madeForKids": false,
      "notifySubscribers": true,
      "playlistCandidate": "",
      "audience": "general",
      "shortsCandidate": true
    },
    {
      "day": "011",
      "videoUrl": "https://www.youtube.com/watch?v=REPLACE_DAY011",
      "titleOverride": "",
      "descriptionOverride": "",
      "thumbnailUrl": "",
      "dueAtOverride": "",
      "privacy": "public",
      "madeForKids": false,
      "notifySubscribers": true,
      "playlistCandidate": "",
      "audience": "general",
      "shortsCandidate": true
    },
    {
      "day": "012",
      "videoUrl": "https://www.youtube.com/watch?v=REPLACE_DAY012",
      "titleOverride": "",
      "descriptionOverride": "",
      "thumbnailUrl": "",
      "dueAtOverride": "",
      "privacy": "public",
      "madeForKids": false,
      "notifySubscribers": true,
      "playlistCandidate": "",
      "audience": "general",
      "shortsCandidate": true
    },
    {
      "day": "013",
      "videoUrl": "https://www.youtube.com/watch?v=REPLACE_DAY013",
      "titleOverride": "",
      "descriptionOverride": "",
      "thumbnailUrl": "",
      "dueAtOverride": "",
      "privacy": "public",
      "madeForKids": false,
      "notifySubscribers": true,
      "playlistCandidate": "",
      "audience": "general",
      "shortsCandidate": true
    },
    {
      "day": "014",
      "videoUrl": "https://www.youtube.com/watch?v=REPLACE_DAY014",
      "titleOverride": "",
      "descriptionOverride": "",
      "thumbnailUrl": "",
      "dueAtOverride": "",
      "privacy": "public",
      "madeForKids": false,
      "notifySubscribers": true,
      "playlistCandidate": "",
      "audience": "general",
      "shortsCandidate": true
    },
    {
      "day": "015",
      "videoUrl": "https://www.youtube.com/watch?v=REPLACE_DAY015",
      "titleOverride": "",
      "descriptionOverride": "",
      "thumbnailUrl": "",
      "dueAtOverride": "",
      "privacy": "public",
      "madeForKids": false,
      "notifySubscribers": true,
      "playlistCandidate": "",
      "audience": "general",
      "shortsCandidate": true
    }
  ]
}
